"initiative_id","spot_counts","active_spots","station_list","ordered_impressions","delivered_impressions"
"1cee16cd-a06a-450e-99ac-9a0d1f2b0424",1702,1702,"KQXT-F3, KAJA-FM, WOAI-AM, KXXM-FM, KQXT-FM, KZEP-FM",387333288,387333288
a8bf5f45-67ac-4799-b19c-f3b454fbd955,68,68,WCOS-FM,4968620.0,4968620.0
c1bcc9c9-121b-4c9c-8411-1eb61db40faf,111,111,"WARF-AM, WAKS-F2, WAKS-FM, WTAM-AM, WMJI-FM, WGAR-FM, WMMS-FM",6056923.0,6056923.0
"08ef350c-1c3c-47cd-897a-1154df1b07e3",564,564,"WAKS-FM, WHLK-FM, WMMS-FM, WARF-AM, WMJI-FM, WGAR-FM, WAKS-F2, WTAM-AM",43921610,43921610
"10c4ddd6-f399-4bf8-86f3-4eefa39961f5",2248,2248,"WRFQ-FM, WXLY-FM, WYNA-FM, WWWZ-FM, WJJS-FM, WYYD-FM, WMGL-FM, WROV-FM, WSSX-FM, WDAI-FM, WGTR-FM, WSYN-FM, WSTV-FM, WSCC-FM, WRXZ-FM, WWXM-FM, WEZL-FM, WIWF-FM, WLFF-FM, WSEA-FM, WAYS-AM, WLUB-FM, WBBQ-FM, WLQB-FM, WKSP-FM, WPRW-FM, WLUB-F2",124242304,124242304
"4243c8bd-cddc-4c0c-afab-0db45a24a000",497,497,"KMYT-FM, KTMQ-FM, KPWK-AM, KGGI-FM, KQIE-FM, KTIE-AM",81655448,81655448
"66671785-df6b-4eb2-afbf-fda9874da695",1318,1318,"WDAS-FM, KIIS-FM, WLTW-FM, WHTZ-FM, KBIG-FM, WHYI-FM, KDGE-FM, KIOI-FM, WLIT-FM, WIOQ-FM, WXKS-FM, WZLX-FM, WKSC-FM, KHKS-FM, KYLD-FM, WBGG-FM",578039476,578039476
"828291a2-b3bb-4b92-a1a4-34c8bc89c950",1040,1040,"WKTU-FM, WLTW-FM, WHTZ-FM, WAXQ-FM, WWPR-FM, WOR-AM",594722169,594722169
a129cfcf-383a-4e39-a64a-0b996e688020,516,516,"WEND-FM, WLKO-FM, WRFX-FM, WKKT-FM, WNKS-FM, WKQC-FM, WPEG-FM, WSOC-FM, WHQC-FM, WBAV-FM",59916026,59916026
a1474a8c-13f7-4459-9c81-a480e17e4d61,251,251,KISO-FM,10906531,10906531
b9bc44bc-42c1-41b2-a49f-0fb63119d76d,244,244,"WYLD-FM, WYLD-AM, WRNO-FM, WRNO-F2, WNOE-FM, KVDU-FM, WQUE-FM",26787986,26787986
bf688a7f-c881-474f-9286-5aa83628800c,727,727,"KXKL-FM, KRFX-FM, KTCL-FM, KSME-FM, KBPI-FM, KIMN-FM, KYGO-FM, KKFN-FM, KOSI-FM, KXBG-FM",53204544,53204544
d226e2be-1ab8-4639-857d-1eec9b617263,312,312,"KYRV-FM, KSTE-AM, KBEB-FM, KFBK-AM, KSAC-AM",26696950,26696950
d5c1a2d0-22ac-421c-9c38-e0d68b9cf81e,5186,5186,"WLLR-FM, KMJK-FM, KGLI-FM, KQCH-FM, KCQQ-FM, KFAB-AM, WHO-AM, KCMO-FM, KXKT-FM, KSFT-FM, KUUL-FM, KASI-AM, KSEZ-FM, KOSY-FM, WMT-AM, KMXG-FM, KMJM-AM, KDRB-FM, KXNO-AM, KGOR-FM, KKSY-FM, KCYZ-FM, KKRQ-FM, WOC-AM, KKDM-FM, KISO-FM, KCFX-FM, KXIC-AM, KHKI-FM, KCJK-FM, KWQW-FM, KCMO-AM, KFFF-FM, KCMO-F2, KXSP-AM, WFXN-AM, KKCD-FM, KGGO-FM, KJJY-FM, KEZO-FM, KSRZ-FM, KBGG-AM",209966862,209966862
fb609861-ee1b-4174-8766-2c71800a3dfb,1629,1629,"KOHT-FM, KNST-AM, KHYT-FM, KXEW-AM, KTZR-AM, KSZR-FM, KRQQ-FM, KHUD-FM, KMMA-FM, KIIM-FM, KCUB-AM, KTUC-AM",193221661,193221661
fe1b2c30-5c1b-477c-aa89-62f9d8ed4ae7,624,624,"KWNR-FM, KYMT-FM, KYMT-F2",41585731,41585731
"16983984-66b6-4b9b-bfd4-6d6ccb01744e",104,104,WISN-AM,9065675.0,9065675.0
"3d837bef-fba3-458b-a512-45748a79f2e2",393,393,"KQXL-FM, WJBO-AM, WXOK-AM, WYNK-FM, KRVE-FM, WFMF-FM, WRQQ-FM, WEMX-FM, WDGL-FM, WYNK-F2, KVDU-FM",21670075,21670075
a0fbf261-9962-4239-a1d0-fa6325d7c01f,307,307,"WMAL-FM, WMZQ-FM, WMZQ-F2, WWDC-F2, WASH-FM, WIHT-FM, WBIG-FM, WTOP-FM",43210974,43210974
e1334a4c-0c68-4a79-8150-624e7ed55f56,352,352,"WZHT-FM, WWMG-FM, WHLW-FM, WMXS-FM, WHHY-FM, WXFX-FM, WLWI-AM",14953589,14953589
d16038dd-a32f-4801-a3be-96b646a13f07,270,270,"KOSY-FM, WMT-AM, KKSY-FM, KXIC-AM, KKRQ-FM, KMJM-AM",9653146.0,9653146.0
"268dd489-2b1d-42d9-9c0c-276dbbf5797f",3479,3479,"WLTW-FM, WOR-AM, WHTZ-FM, WKTU-FM, WAXQ-FM, KOST-FM, KEIB-AM, WSRV-FM, KFI-AM, WWPW-FM, WJJK-FM, WFMS-FM, WIBC-FM, WFSH-FM, WFBQ-FM, KBIG-FM, WZPL-FM, WALR-FM, WUBL-FM, WSB-AM, KLOS-FM, KIIS-FM, KYSR-FM, WYXB-FM, WLHK-FM, WRDG-FM, KLAC-AM, WXNY-FM, WTTS-FM, KLVE-FM",922880405,922880405
"3063c8da-3722-4d59-95f9-3da687bdb665",190,190,"WUBL-FM, WNNX-FM, WWWQ-FM, WFSH-FM, WWPW-FM, WSTR-FM, WRDG-FM, WWWQ-F3, WKHX-FM, WSB-AM, WALR-FM, WSB-FM, WSRV-FM",24691920,24691920
"4f79393f-def5-4133-ad35-3512f6eb63f1",445,445,"WPYX-FM, WGY-AM, WRVE-FM",29987869,29987869
"75f8146c-7570-48a4-b258-2bd8e9c7d727",299,299,"WMJI-FM, WMMS-FM, WGAR-FM, WTAM-AM",26815244,26815244
"76e8a6fb-47ad-4768-a70f-f71bbbfa59c2",331,331,"WAIO-FM, WHAM-AM, WDVI-FM, WHTK-AM, WNBL-FM, WKGS-FM, WVOR-FM",19000322,19000322
"7c50f331-4bb8-4453-9db5-ef56088f08af",631,631,"KJR-FM, KBKS-FM, KJEB-FM, KZOK-FM, KJAQ-FM, KQMV-FM, KRWM-FM, KJR-AM, KNWN-AM, KPLZ-FM",73919852,73919852
"80d9ebef-21c3-4eca-b440-070f5ad97a9e",191,191,"WMMS-FM, WHLK-FM, WGAR-FM, WMJI-FM, WENZ-FM, WAKS-FM, WTAM-AM, WZAK-FM, WMMS-F3",15876481,15876481
"85961400-acad-4bcd-89f8-b79c92b3b86f",1754,1754,"KVET-AM, KVET-FM, KPEZ-FM, KHFI-FM, KASE-FM, KASE-F2, KLBJ-AM, KLBJ-FM, KBPA-FM",268981097,268981097
dc4bda90-4b34-421d-b3f5-da9aca4306dd,1214,1214,"WKCY-AM, WKDW-AM, WACL-FM, WKCY-FM, WSVO-FM, WAZR-FM",17840462,17840462
fb3d5dc8-0671-4ea3-a346-b712e9b6e931,1312,1312,"KRXQ-FM, KBEB-FM, KFBK-AM, KSEG-FM, KHYL-FM, KIFM-AM, KSFM-FM, KSTE-AM, KYRV-FM, KUDL-FM, KKDO-FM, KZIS-FM, KUBA-AM, KSAC-AM",71310033,71310033
fed07f02-f06d-4f90-b172-a25e355b02e1,382,382,"WQYZ-FM, WKNN-FM, WMJY-FM, WBUV-FM",20324107,20324107
"04fa3674-6aaa-4db8-81b2-99e1c5ec5ad8",171,171,"WCTQ-FM, WSRZ-FM",7365930.0,7365930.0
"10091eac-8611-4ff9-b7af-486b52ec6708",292,292,"WFLA-AM, WDAE-AM, WFUS-FM, WXTB-FM, WHNZ-AM",32497528,32497528
"830f0806-86a1-453f-8609-d970359cc2df",784,784,"WGIR-FM, WGIR-AM, WHEB-FM, WTBU-FM, WPKX-AM",24764907,24764907
"85f4ed19-5dc4-4eb6-9b52-2faff3fe4f97",762,762,"WMZQ-F2, WWDC-F2, WASH-FM, WMZQ-FM, WIHT-FM, WBIG-FM, WMMJ-FM, WWDC-FM, WMAL-FM, WKYS-FM, WHUR-FM",128647457,128647457
"898218dd-a880-4ad4-9070-a34d9854a7be",224,224,WNDH-FM,5527650.0,5527650.0
ca41bfab-a9f9-4796-a365-6e7f4d1a6422,2788,2788,"WHLK-FM, WMJI-FM, WKDD-FM, WAKS-F2, WTAM-AM, WAKS-FM, WRQK-FM, WHLO-AM, WMMS-FM, WGAR-FM, WHOF-FM, WMMS-F3",238024063,238024063
d4a31f97-2b03-4e40-88f0-fee928036422,1780,1780,"WIOD-AM, WBGG-FM, WMIB-FM, WHYI-FM, WZTU-FM, WMIA-FM, WAMR-FM, WINZ-AM, WRTO-FM, WEDR-FM, WHQT-FM, WFLC-FM",429572952,429572952
d4c3de6d-8610-4024-a3a0-d8ff0f98745c,407,407,"KFAB-AM, KGOR-FM, KISO-FM, KFFF-FM, KXKT-FM",28553435,28553435
e07e260f-510e-41eb-9316-46a3ab62a20f,480,480,"WNIC-FM, WDZZ-FM, WFBE-FM, WWCK-AM, WMGC-FM, WWCK-FM, WJLB-FM, WLLZ-FM, WTRX-AM",46046272,46046272
e192fe41-d42c-4437-aea4-da5516d4d69d,494,494,"WSCC-FM, WRFQ-FM, WSSX-FM, WXLY-FM, WIWF-FM, WMGL-FM, WWWZ-FM, WEZL-FM",17631857,17631857
eab2b1a3-a570-45da-aa8e-e650779d9c6c,847,847,"WAKZ-FM, WMXY-FM, WHLK-FM, WMJI-FM",41592653,41592653
"0e8b5513-3b8a-4d94-9b63-c132a6cee9ac",1294,1294,"KTBZ-FM, KQBT-FM, KTRH-AM, KAMA-FM, KBME-AM, KROI-FM, KMJQ-FM, KODA-FM, KOVE-FM, KPRC-AM, KLTN-FM, KRBE-FM, KBXX-FM, KRBE-F2, KGLK-FM, KQBU-FM",454373880,454373880
"2d2ed992-49ea-4e4a-94b7-bba83cec547c",833,833,"WLLR-FM, KCQQ-FM, KUUL-FM, KMXG-FM, WOC-AM, WFXN-AM",31551566,31551566
"56c153bd-3a8d-41a2-bcdd-ff4b655dd510",1479,1479,"WDIZ-AM, WSDV-AM, WCTQ-FM, WTZB-FM, WRUB-FM, WSRZ-FM, WBTP-FM",88905004,88905004
"6ace696e-7446-4e85-a519-ea713ba09050",2694,2694,"WEAT-FM, WLDI-FM, WZZR-FM, WKGR-FM, WRLX-FM, WIRK-FM, WMBX-FM, WOLL-FM, WRMF-FM, WBZT-AM, WJNO-AM",130476685,130476685
"89c7ee08-9362-42b2-b567-7f2b0b88a688",622,622,"KAJA-FM, KQXT-FM, KXXM-FM, KKYX-AM, KRPT-FM, WOAI-AM, KSMG-FM, KTKR-AM, KISS-FM, KCYY-FM, KONO-AM, KTSA-AM, KTKX-FM, KONO-FM, KVBH-FM, KTFM-FM",64205832,64205832
"91b1a20d-51a6-4a9f-a4b4-84fe25a4445e",919,919,"WTKS-FM, WTKS-F2, WXXL-FM, WRUM-FM, WMGF-FM, WYGM-AM, WFLF-AM, WJRR-FM",58152370,58152370
ab6a8206-85aa-44b5-9ed7-805e04af94ac,317,317,"WDVI-FM, WAIO-FM, WHAM-AM",19644088,19644088
d45bbcd1-8589-4b2d-ad07-6149ddb59042,581,581,"WUSQ-FM, WFQX-FM, WKSI-FM",16996351,16996351
e921dabd-7cd4-4a15-a1f2-5abf97c38657,411,411,"KDMX-FM, WBAP-AM, KTCK-AM, KZPS-FM, KSCS-FM, KDGE-FM, KFXR-AM, KLIF-AM, KEGL-FM, KPLX-FM, KLTY-FM, KHKS-FM",124663068,124663068
"05479fe3-35f2-4479-82aa-2054f7211214",813,813,"WBHK-FM, WZZK-FM, WBPT-FM, WDXB-FM, WMJJ-FM, WUHT-FM, WQEN-FM, WBHJ-FM, WQEN-F2, WMJJ-F2, WZRR-FM, WJQX-FM, WJOX-AM, WERC-FM, WJOX-FM, WERC-F3",56979133,56979133
"055d5504-54a7-47e7-8827-b59fee7af88d",523,523,"KTGX-FM, KMOD-FM, KTBZ-AM, KTBT-FM, KAKC-AM, KTGX-F2, KIZS-FM",25563649,25563649
"0598fd69-0564-4b03-a3cd-fa0b8f37da56",1514,1514,"WUMR-FM, WDAS-FM, WIOQ-FM, WUSL-FM, WRFF-FM, WDAS-AM",575924033,575924033
"0b36354a-5757-4a86-a3fd-b4d43db1ccbd",412,412,"KPTR-AM, KRWM-FM, KZOK-FM, KJR-AM, KJAQ-FM, KJEB-FM, KBKS-FM, KJR-FM, KQMV-FM, KPNW-FM, KIXI-AM, KPLZ-FM, KKNW-AM, KNWN-AM",70505708,70505708
"381e4830-1a63-462a-9b66-dcfbbec87c3f",300,300,"WRQK-FM, WGAR-FM, WHLK-FM, WTAM-AM, WMJI-FM, WARF-AM, WMMS-FM, WMMS-F3",25773647,25773647
"45037192-f0b1-4d10-952e-ae484498c6f4",252,252,"WDAS-FM, WIOQ-FM, WRFF-FM, WUSL-FM, WKXW-FM, WDAS-AM, WPST-FM",31434926,31434926
"4b974448-aece-4279-b6f6-9c130b0b24f0",916,916,"WKDW-AM, WAZR-FM, WACL-FM, WSVO-FM, WKCY-AM, WKCY-FM",7664787.0,7664787.0
"5fa94ec6-4591-48f0-8069-629fca86f1f9",672,672,"WUSQ-FM, WFQX-FM, WMRE-AM, WKSI-FM",7908026.0,7908026.0
"9d21c96f-9fd1-4d51-973b-b42ba74ec9bb",498,498,"KLSD-AM, KIOZ-FM, KOGO-AM, KGB-AM, KHTS-FM, KGB-FM, KSSX-FM, KMYI-FM, KLQV-FM, KFBG-FM, XHRM-FM, KLNV-FM",45626940,45626940
a425dd3f-3163-474d-ad98-dcd84f99f48c,314,314,"WTQR-FM, WMKS-FM, WPAW-FM, WSMW-FM, WPTI-FM, WQMG-FM, WVBZ-FM, WMAG-FM",9377752.0,9377752.0
bd646561-34b7-4644-bc2a-224f795ec219,1094,1094,"WQIK-FM, WPLA-FM, WKSL-FM, WSOL-FM, WJGL-FM, WOKV-FM",48315397,48315397
c6829d83-9880-4b24-9168-76092f0ea6dc,152,152,"WRKH-FM, WKSJ-FM",11976091,11976091
d267367e-2899-410b-b870-abb6e915ed49,2050,2050,"WLWI-FM, WWMG-FM, WQRV-FM, WZRR-FM, WMXS-FM, WHLW-FM, WXFX-FM, WQEN-FM, WVNN-AM, WHHY-FM, WUHT-FM, WMJJ-FM, WDRM-FM, WZHT-FM, WTAK-FM, WDXB-FM, WZYP-FM, WWFF-FM, WGMZ-FM, WBPT-FM, WUMP-AM, WZZK-FM, WERC-F3, WHRP-FM, WJQX-FM, WMSP-AM, WBHP-AM, WMJJ-F2, WQEN-F2, WERC-F2, WERC-FM, WJOX-FM, WLWI-AM, WJOX-AM, WBHK-FM",105449418,105449418
e63fa892-8db4-4bc5-9de4-701f196caac5,938,938,"WFUS-FM, WMTX-FM, WXTB-FM, WFLA-AM",115338153,115338153
e6cd2c20-9b4a-458d-9a83-e3128a5f8796,1518,1518,"KBER-FM, KAAZ-FM, KUBL-FM, KODJ-FM, KNRS-FM, KBEE-FM, KKAT-AM, KZHT-FM, KJMY-FM, KENZ-FM, KJMY-F2",204372585,204372585
ff5d66c5-4bcc-4f04-a2ca-c3cbd1884165,2109,2109,"WNCI-FM, WBEX-AM, WSPD-AM, WIMT-FM, WIOT-FM, WZRX-FM, WCHO-FM, WDFM-FM, WNDH-FM, WCHI-AM, WYFM-FM, WGRR-FM, WCHO-AM, WLW-AM, WMXY-FM, WVHU-AM, WBVB-FM, WBBG-FM, WQXK-FM, WTCR-FM, WNNF-FM, WKBN-AM, WRVF-FM, WCOL-FM, WAKZ-FM, WAMX-FM, WKEE-FM, WRRM-FM, WHOT-FM, WGAR-FM, WKKJ-FM, WIMA-AM, WHLO-AM, WRQK-FM, WRQN-FM, WHLK-FM, WBKS-FM, WKKO-FM, WTAM-AM, WOFX-FM, WZOM-FM, WMMS-FM, WVKS-FM, WODC-FM, WTVN-AM",76700386,76700386
"3d085029-d35b-4e9d-8d47-a2245827bc61",1376,1376,"KWQW-FM, KCYZ-FM, KXNO-AM, KGGO-FM, KKDM-FM, KDRB-FM, KHKI-FM, KJJY-FM, WHO-AM, KASI-AM",211379436,211379436
"6573bcfc-019f-4ba9-8bb0-2958258c346d",1070,1070,"WMMS-FM, WAKS-FM, WGAR-FM, WHLK-FM, WMJI-FM, WTAM-AM",100070970,100070970
"697f802f-2279-4ba6-ba59-725186fd7277",320,320,WYNK-FM,31683172,31683172
"8853f180-e760-4efa-a021-860b093b6453",499,499,"WCHI-FM, WVAZ-FM, WKSC-FM, WGCI-FM, WTMX-FM, WOJO-FM, WPPN-FM, WGN-AM, WDRV-FM",146727293,146727293
b12c65a9-0558-4046-a8cc-fc37f1a143b5,229,229,KFFF-FM,14578522,14578522
eaf3a92b-943a-4a8a-b95f-1e5ac5c017e1,670,670,"KHUD-FM, KHYT-FM, KCUB-AM, KTZR-AM, KNST-AM, KIIM-FM, KRQQ-FM, KOHT-FM, KXEW-AM, KMMA-FM",50769552,50769552
ecf3dc5d-31ba-41d3-a8b6-fdc365de94cd,627,627,"KJMY-FM, KZHT-FM, KENZ-FM, KODJ-FM, KAAZ-FM, KBEE-FM, KNRS-FM, KSOP-AM, KKAT-AM, KJMY-F2, KUBL-FM, KBER-FM",36461132,36461132
"03adf6d5-8d34-4b9a-8a51-ce66dfd3b8ec",111,111,KNRS-FM,17833470,17833470
"4957d289-1855-4192-be1a-762950678d57",675,675,"WIBA-F2, WIBA-AM, WXXM-FM, WZEE-FM, WIBA-FM, WMAD-FM, WTSO-AM",15793131,15793131
"565b67e1-15e6-4086-8312-fdd76e125308",440,440,"WDRM-FM, WZYP-FM, WVNN-AM, WHRP-FM, WBHP-AM, WTAK-FM, WUMP-AM, WWFF-FM, WQRV-FM",19311519,19311519
"5d26c948-4f0d-4737-b0fb-ef9c324ed5bc",148,148,"WCHD-FM, WZDA-FM, WMMX-FM, WONE-AM, WTUE-FM",12976357,12976357
"6bb4adaa-0004-486d-8ddd-5cc2261f5346",685,685,"WLRQ-FM, WFKS-FM, WMMB-AM",40452633,40452633
"717efd60-e7ce-4d8d-b624-6619d1117398",196,196,"KOA-AM, KRFX-FM, KIMN-FM, KRKS-FM, KDFD-AM, KUVO-FM",39936991,39936991
"78799c78-5427-440e-bdff-6acff6ba2dbc",857,857,"WVOR-FM, WAIO-FM, WDVI-FM, WHAM-AM, WKGS-FM, WNBL-FM, WHTK-AM",53423804,53423804
"06054f6e-0e22-4fc3-bbc8-3cce15748c7b",789,789,"KJMY-FM, KAAZ-FM, KNRS-FM, KODJ-FM, KZHT-FM, KBEE-FM, KENZ-FM, KKAT-AM, KJMY-F2, KSOP-FM, KBER-FM",49750703,49750703
"06a97deb-fbbe-4eb4-9b7a-93a9668c007e",271,271,"WARF-AM, WMMS-FM, WMJI-FM, WGAR-FM, WAKS-FM, WHLK-FM, WAKS-F2, WTAM-AM",17866241,17866241
"114dc2df-87c5-4dbc-b234-2fec3898871d",327,327,"WCTK-FM, WWBB-FM, WHJY-FM, WSNE-FM, WHJJ-AM",13474757,13474757
"116a3f68-0a20-4f16-b923-4e1cc067e593",733,733,"WQSR-FM, WPOC-FM, WCAO-AM, WZFT-FM, WBAL-AM, WIYY-FM, WCBM-AM",85620496,85620496
"1d38adee-0fad-4547-a8c7-617ad3225254",343,343,"WRTO-FM, WMIA-FM, WAMR-FM",140169141,140169141
"4c3ac4d7-b42b-4d16-9dab-50e0531e5cc4",311,311,"KGOR-FM, KFFF-FM, KISO-FM, KFAB-AM, KXKT-FM",13362271,13362271
"63052bfe-958a-4e6c-b0b4-72fc7153625d",790,790,"WAMZ-FM, WSDF-FM, WQMF-FM, WNRW-FM, WHAS-AM, WKJK-AM",41307626,41307626
"6a14229f-3929-4d94-9265-b0f5b63c68e8",1222,1222,"KRAB-FM, KBFP-AM, KHTY-AM, KBFP-FM, KDFO-FM",102363196,102363196
"8a442288-9c9c-49d1-a05b-d637a774ee57",145,145,"WLTY-FM, WVOC-AM, WCOS-FM",8084098.0,8084098.0
"9f342a3e-9afa-465f-8dfe-80d4a94dace5",473,473,"WZLX-FM, WXKS-AM, WBWL-FM",113993261,113993261
ab624ec4-31b0-4c22-beca-7dd8ba175cd6,1052,1052,"WSNX-FM, WBFX-FM, WOOD-AM, WSRW-FM, WMAX-FM, WMUS-FM, WMRR-FM, WBCT-FM, WJLB-FM, WRIF-FM, WKQI-FM, WNIC-FM, WMGC-FM, WLLZ-FM, WCSX-FM, WTRX-AM, WMXD-FM, WWCK-FM, WWCK-AM",92451899,92451899
bd811806-5f4c-4d8b-92ce-40b8bc4fbdff,541,541,"KTCZ-FM, KFXN-FM, KEEY-FM, KDWB-FM, KTLK-AM, KQQL-FM, WGVX-FM, KXXR-FM, KQRS-FM",147472775,147472775
f02dcca2-3eaa-45fd-9d20-bc1cd9d9a4a9,1320,1320,"WKSI-FM, WUSQ-FM, WMRE-AM, WFQX-FM",46132901,46132901
"28388b2e-0b66-49ca-a186-7bae591d6d05",1384,1384,"WQBZ-FM, WJYZ-AM, WDEN-FM, WOBB-FM, WMRZ-FM, WGEX-FM, WBBQ-FM, WIHB-FM, WPEZ-FM, WKXC-FM, WIBB-FM, WKSP-FM, WIHB-AM, WLUB-FM, WMGB-FM, WRBV-FM, WLZN-FM, WCHZ-FM, WDRR-FM, WJIZ-FM, WHHD-FM, WLUB-F2, WRZX-AM, WGAC-AM, WMGP-FM, WPRW-FM, WMAC-AM, WGST-AM",40823968,40823968
"56c84a90-a226-4d0d-9c88-078a81e3e7d2",1002,1002,"KFXN-FM, KTCZ-FM, KEEY-FM, KQQL-FM, KTLK-AM, KDWB-FM, WGVX-FM",213308039,213308039
"73ff8f1f-5bd4-41be-9db4-66fcd33954cc",439,439,"KSD-FM, KLOU-FM, KTLK-FM",61982154,61982154
b614755d-271a-41a4-a333-1bf6a506746d,474,474,"KBKS-FM, KJR-FM, KJR-AM, KJAQ-FM",54332926,54332926
bd892546-0bc6-4156-b020-c61c0f77f3f8,189,189,"KSNE-FM, KKLZ-FM",19930240,19930240
"26f732e6-6934-4323-a20f-35c343b87154",305,305,"WPTI-FM, WTQR-FM, WMAG-FM, WVBZ-FM, WMKS-FM",11562198,11562198
"2dbf3aaa-0a4f-4657-8067-39bc98190724",1694,1694,"WRIF-FM, WJR-AM, WKQI-FM, WJLB-FM, WNIC-FM, WLLZ-FM, WMGC-FM, WMXD-FM, WCSX-FM, WDVD-FM, WDMK-FM",213944834,213944834
"372e37c5-9f84-4067-9709-f2b2c43bd47c",382,382,"WXBM-FM, WCOA-AM, WJTQ-FM, WRRX-FM, WTKX-FM, WMEZ-FM, WRGV-FM",35975420,35975420
"599a37c7-70bc-4758-858a-64da90c766a4",386,386,"WZLX-FM, WXKS-AM",96371707,96371707
"76be66af-ea89-446f-809f-0750db323a46",42,42,"KTCZ-FM, KQQL-FM, KDWB-FM",10249104,10249104
"89c41ce5-3fcb-4fd5-b1db-da6e674acf5b",272,272,"WMIA-FM, WAMR-FM, WRTO-FM",95150426,95150426
"967cda25-91d0-45b3-884e-4c68d4eff8f2",424,424,"WCAO-AM, WMZQ-F2, WIHT-FM, WOL-AM, WHUR-FM, WWDC-F2, WMMJ-FM, WYCB-AM",77831110,77831110
"98bdccbd-9d81-4b86-9910-84e5020426e9",501,501,"WKTU-FM, WLTW-FM, WHTZ-FM, WAXQ-FM, WOR-AM",446079001,446079001
b376de62-702f-4e8a-b9f9-a2032720dfdc,468,468,"WODE-FM, WLEV-FM, WAEB-FM, WCTO-FM, WAEB-AM",19811361,19811361
"1191a467-4e57-4cb6-af37-1fe7e43e2bbc",230,230,"WPOC-FM, WCAO-AM, WQSR-FM, WBAL-AM",26259652,26259652
"1eda1000-abb1-4520-ae8b-553de74e83eb",475,475,"WBBS-FM, WYYY-FM, WSYR-AM, WAQX-FM",15771580,15771580
"26df5d5d-f45c-4e3d-886a-834bb45dca09",200,200,"WWBB-FM, WCTK-FM",7198822.0,7198822.0
"2c3a91b3-2571-44ed-abe3-39633338c4e4",490,490,"WJBT-FM, WSOL-FM",29148513,29148513
"5149d7f7-9c71-462c-9972-f9d812fb3ad7",173,173,"WBAV-FM, WRFX-FM, WKKT-FM, WSOC-FM, WLKO-FM, WHQC-FM, WEND-FM",12270019,12270019
"72a6499f-208b-4847-a1f2-d739a913a348",1451,1451,"WXBB-FM, WJET-AM, WRKT-FM, WTWF-FM, WFNN-AM, WRTS-FM",17441614,17441614
"9260e003-d590-43a2-a859-3d19a232d13e",309,309,"KSMB-FM, KXKC-FM, KNEK-FM, KRRQ-FM",17867705,17867705
"9d87f033-223d-49c4-b2b7-86ba331ab93b",263,263,"KRBE-FM, KTBZ-FM, KBME-AM, KOVE-FM, KRBE-F2, KODA-FM, KPRC-AM, KLTN-FM, KTRH-AM, KAMA-FM, KQBT-FM, KQBU-FM",67191132,67191132
bd8e1619-0c24-4001-a793-413f93955f13,54,54,WTAG-AM,5885094.0,5885094.0
dc883ac1-1225-4a72-99b9-cbafab87d85e,752,752,"WHLH-FM, WSTZ-FM, WJDX-AM, WMSI-FM, WZLD-FM, WJKX-FM, WFFX-FM, WNSL-FM, WJDX-FM",31419007,31419007
"1f6d43c3-9de5-46b9-a50f-80ef7c6d733b",336,336,"WLKO-FM, WRFX-FM, WKKT-FM, WKQC-FM, WSOC-FM, WHQC-FM, WNKS-FM, WBAV-FM, WEND-FM, WPEG-FM",31125977,31125977
"4171c774-2015-43b9-aa15-3668e6a695d9",1721,1721,"KCQQ-FM, KUUL-FM, KMXG-FM, WLLR-FM, WOC-AM",94854859,94854859
"6ab4c40e-01dd-4b74-b298-faead93dd510",778,778,"WSVO-FM, WKCY-AM, WAZR-FM, WKDW-AM, WKCY-FM, WACL-FM",6434964.0,6434964.0
"702c040b-813b-4998-b623-d4ae211938f7",229,229,WRUM-FM,44177037,44177037
"70fec380-4182-4b94-a456-971388ca84ff",984,984,"WOGB-FM, WDUZ-FM, WKRU-FM, WQLH-FM",89113461,89113461
"7de3a36d-a135-430b-989a-b59cef1c851f",378,378,"WAIO-FM, WHAM-AM, WDVI-FM",22753649,22753649
"7f95a13b-0002-450d-9f63-6ef2d4469dfd",669,669,"WPLA-FM, WQIK-FM, WKSL-FM, WJBT-FM, WSOL-FM",20328594,20328594
"85beb319-f230-4131-878d-df7da1436049",503,503,"WNOK-FM, WLTY-FM, WVOC-AM, WXBT-FM, WCOS-FM",21817414,21817414
"8d5f1f6b-6e24-4561-b1b3-28099f3c12a4",277,277,"WAKS-FM, WHLK-FM, WMMS-FM, WMJI-FM, WGAR-FM, WTAM-AM, WENZ-FM, WZAK-FM",21039299,21039299
aff7fd67-86a0-4cad-8cc2-1a884429528e,235,235,"WGOW-AM, WGOW-FM, WOGT-FM, WSKZ-FM",9635937.0,9635937.0
e8fe0c9e-5cf3-4c8a-88bb-fec49bf13e7f,2784,2784,"WCHO-FM, WNDH-FM, WCHO-AM, WHOT-FM, WLW-AM, WYFM-FM, WBKS-FM, WKKO-FM, WVKS-FM, WQXK-FM, WCHI-AM, WODC-FM, WVHU-AM, WBBG-FM, WBVB-FM, WGAR-FM, WOFX-FM, WHLK-FM, WRVF-FM, WCOL-FM, WBEX-AM, WTCR-FM, WKEE-FM, WMMS-FM, WZRX-FM, WIOT-FM, WSPD-AM, WNCI-FM, WRQN-FM, WDFM-FM, WMXY-FM, WKKJ-FM, WIMA-AM, WRQK-FM, WKDD-FM, WGRR-FM, WAKZ-FM, WAMX-FM, WZOM-FM, WIMT-FM, WNNF-FM, WENZ-FM, WRRM-FM, WKBN-AM, WTAM-AM, WTVN-AM, WPIC-AM, WSAI-AM, WARF-AM, WZWB-AM, WLLF-FM, WDOH-FM, WONW-AM, WKFS-FM, WNCD-FM, WBBW-AM, WEGE-FM, WCKY-AM, WHLO-AM, WMLX-FM, WXKR-FM, WWIZ-FM, WZCB-FM, WZAK-FM, WCIT-AM, WVKS-F2, WCWA-AM, WRQX-AM, WBUK-FM, WNIO-AM, WQQO-F2, WQQO-FM, WQLX-FM, WMIM-FM",114441592,114441592
ed4008ab-3b93-49e0-8da5-0e879eafaf1e,349,349,"WHLW-FM, WLWI-FM, WWMG-FM, WZHT-FM",13500473,13500473
"05b2ad66-e5af-41a9-8ed3-133f06bafad3",4440,4440,"WXDX-FM, WBGG-AM, WISN-AM, WMIL-FM, WNDE-AM, WPGB-FM, WZRL-FM, WOLT-FM, WDVE-FM, WKKV-FM, WOLT-F2, WFBQ-FM, WWSW-FM, WRNW-FM, WOKY-AM",270370444,270370444
"18d9d1a2-f83c-4f19-87d8-6b042382cb31",1127,1127,"WQRV-FM, WVNN-AM, WZYP-FM, WDRM-FM, WHRP-FM, WTAK-FM, WWFF-FM, WUMP-AM",45292850,45292850
"24cb387b-eb1f-4f45-8a52-2d69d30bba22",2715,2715,"WHNZ-AM, WBTP-FM, WYUU-FM, WFLZ-FM, WFUS-FM, WRBQ-FM, WQYK-FM, WRUB-FM, WMTX-FM, WXTB-FM, WPBB-FM, WLLD-FM, WDAE-AM, WFLA-AM",355013058,355013058
"407af801-aa1b-4fe5-b252-3bdfd28479d8",1187,1187,"WMMX-FM, WTUE-FM, WONE-AM, WZDA-FM, WCHD-FM",112810969,112810969
"57375d0e-e6ba-45d9-8c38-271115a75151",553,553,"WLW-AM, WNNF-FM, WOFX-FM, WKRC-AM, WCKY-AM, WKFS-FM",46025334,46025334
"5e1ae990-7c37-4b42-aa22-9bae72811582",731,731,"WBAP-AM, KZPS-FM, KEGL-FM, KSCS-FM, KTRH-AM, KTCK-AM, WACO-FM, KDGE-FM, KHKS-FM, KLNO-FM, KFXR-AM, KLIF-AM, KDMX-FM",209323401,209323401
"865faebb-7e5d-4d57-ac62-5e0eea71ac8e",253,253,"WKKT-FM, WRFX-FM, WHQC-FM, WKQC-FM, WNKS-FM, WLKO-FM, WEND-FM, WPEG-FM, WBAV-FM, WSOC-FM",28724523,28724523
"8664dbe6-8a91-4361-bafd-d7564e532d37",194,194,"WHAS-AM, WKRD-AM, WKJK-AM",9943450.0,9943450.0
"9a68ab84-5252-4ec0-8eec-8f162b1fcaf1",731,731,"KZOK-FM, KJAQ-FM, KJR-FM, KJR-AM, KBKS-FM, KJEB-FM, KPNW-FM, KKNW-AM, KPTR-AM, KRWM-FM, KQMV-FM, KIXI-AM, KNWN-AM",148543416,148543416
a65c3ea5-c0e7-4e1c-ad4b-e3414087076d,9526,9526,"WJDX-AM, WHLH-FM, WMSI-FM, WSTZ-FM, KTOZ-FM, WJDX-FM, KSWF-FM, KSGF-FM, WZTU-FM, KHKN-FM, KDJE-FM, KGBX-FM, KARN-FM, WMIA-FM, KSSN-FM, WINZ-AM, KGMY-AM, WMGF-FM, WCFB-FM, KLAL-FM, KPZK-FM, WZZR-FM, WIRK-FM, KAMO-FM, WKGR-FM, KOKY-FM, KXUS-FM, KRMW-FM, WRLX-FM, WMIB-FM, WBGG-FM, WHYI-FM, WJNO-AM, WXXL-FM, WTKS-FM, WMBX-FM, WLDI-FM, WRMF-FM, KQSM-FM, WXXL-F2, KURB-FM, KMJX-FM, KEZA-FM, WMIA-F3, KKEG-FM, KMXF-FM, KMCK-FM, KIGL-FM, WZZR-F2, WJRR-FM, WRUM-FM, KFAY-AM, KKIX-FM, WEAT-FM, KIPR-FM, WBZT-AM, WOLL-FM, WFLF-AM, WOEX-FM, WRSO-AM, WMGF-F2, KRVI-FM, WIOD-AM, KTTS-FM, WYGM-AM, KYNG-AM, WAMR-FM, WWKA-FM, WRTO-FM, WRUM-F2, WORC-FM, WSRS-FM, WTAG-AM, WHYN-FM, WWFX-FM, WMTX-FM, WHYN-F2, WPBB-FM, WBTP-FM, WRNX-FM, WFUS-FM, WHYN-AM, WQYK-FM, WDAE-AM, WFLA-AM, WFLZ-FM, WRBQ-FM, WLLD-FM, WXLO-FM, WTKS-F2, WFEZ-FM, WMMO-FM, WEDR-FM, WHQT-FM, WFLC-FM, WDBO-AM, WWNN-AM",953621328,953621328
be86f058-e6af-415f-97e0-9510211dd72c,203,203,KFAB-AM,20249395,20249395
e13cc143-f113-4be1-9e74-664c7f62008e,443,443,"WQRV-FM, WTAK-FM, WDRM-FM, WVNN-AM, WBHP-AM, WUMP-AM",13246466,13246466
f771f4c0-ad18-470e-85e7-c26578a2ead4,730,730,"WUCS-FM, WHCN-FM, WDRC-FM, WWYZ-FM, WKSS-FM, WPOP-AM, WZBG-FM",26726351,26726351
"027d558a-87e4-4307-9935-5ea181e9b66e",336,336,"WRFQ-FM, WMGL-FM, WSCC-FM, WIWF-FM",14951299,14951299
"0cb3f11b-9c66-4c8b-969f-5d4b99a6ea95",841,841,"WGAR-FM, WHLK-FM, WMJI-FM, WARF-AM, WAKS-F2, WAKS-FM, WMMS-FM, WTAM-AM, WENZ-FM, WMMS-F3, WMMS-F2",53904696,53904696
"1db76b6e-9c29-4381-a340-377422b4f0fb",922,922,"KTCZ-FM, KQQL-FM, KFXN-FM, KDWB-FM, KEEY-FM, KTLK-AM, WGVX-FM, KQRS-FM, KXXR-FM",225049011,225049011
"27fcb6e5-5432-4473-924e-295960e1ec0b",800,800,"WARH-FM, KLOU-FM, KSD-FM, WXOS-FM, WIL-FM, KSLZ-FM",66606004,66606004
"49b62b4f-4163-43f7-a131-4947287a6100",1146,1146,"KIIX-AM, KSME-FM, KPAW-FM, KCOL-AM, KXBG-FM, KBPI-FM",68197094,68197094
"5771ab19-ee18-4769-9101-3ccbd16feefc",122,122,"WKKT-FM, WLKO-FM",18328996,18328996
"67c260bc-7b99-4ec5-8f60-53ad2285b390",1277,1277,"WOFX-FM, WRRM-FM, WGRR-FM, WEBN-FM, WLW-AM, WFTK-FM, WCKY-AM, WKRC-AM, WSAI-AM, WKFS-FM, WNNF-FM, WNKR-FM",103871641,103871641
"7b1400a2-ebf5-490f-8eab-44534388f43a",40222,40222,"KENI-AM, KIKI-AM, KWNR-FM, KYRV-FM, KFBK-AM, KLSD-AM, KFI-AM, KBFX-FM, KUCD-FM, KUBT-F2, KHGE-FM, KTMQ-FM, KHVH-AM, KALZ-FM, WSTZ-FM, KMOD-FM, WMRZ-FM, KAKC-AM, WRFQ-FM, KTRH-AM, KTBZ-AM, WTSO-AM, KXKT-FM, WOBB-FM, KAJA-FM, KFFF-FM, WXBT-FM, WKSF-FM, KJR-FM, KASE-F2, WJDX-AM, WQNQ-F2, WJIZ-FM, WQBZ-FM, WLUB-F2, WKKT-FM, KVET-FM, WRFX-FM, KVET-AM, KGOR-FM, WMSI-FM, KSWF-FM, KMJX-FM, KTGX-F2, WAGH-FM, KION-AM, KHYL-FM, WSCC-FM, WRDU-FM, WCOS-AM, WPRW-FM, KFAB-AM, WDAK-AM, KBME-AM, KYMT-FM, WCOS-FM, KFXR-AM, KGMY-AM, WMIL-FM, WACO-FM, KASE-FM, WCZR-FM, WAVW-FM, WPLA-FM, WLUB-FM, WUBL-FM, KBRQ-FM, WIKX-FM, KHTY-AM, KMRQ-FM, WIBA-AM, WWNC-AM, WTKX-FM, KLAC-AM, KNCN-FM, WJKX-FM, WNTM-AM, WQNS-FM, WPAP-F2, KQQL-FM, KTEX-FM, WZLD-FM, WOAI-AM, WDAE-AM, WEZL-FM, KFIV-AM, KAAZ-FM, WKNN-FM, KRYS-FM, WIBA-FM, KKTX-AM, KBGO-F2, WRNW-FM, KTST-FM, WMIB-FM, KTSM-AM, WVOC-AM, KGB-FM, WISN-AM, KIOZ-FM, WSTH-FM, WVRK-FM, WQEN-F2, KIGL-FM, KODJ-FM, KFXN-FM, KZOK-FM, WCTQ-FM, WFFX-FM, KRAB-FM, WKSF-F2, KXUS-FM, KTLK-FM, WMEQ-AM, WOKY-AM, KEGL-FM, WERC-FM, WBUV-FM, WQIK-FM, WPAP-FM, WZHT-FM, KEEY-FM, WXSR-FM, WKSP-FM, WEND-FM, KTOM-FM, KABQ-AM, KOKQ-FM, KASH-FM, WINZ-AM, WTNT-FM, KHEY-FM, WCCF-AM, KTKR-AM, WVBZ-FM, WROO-FM, WSRZ-FM, WBZT-AM, WMMB-AM, WTKS-F2, KABQ-FM, WERC-F3, WJNO-AM, WKSJ-FM, WTAK-FM, WBHP-AM, KSSN-FM, WIOD-AM, KXXY-FM, WFLF-AM, WDXB-FM, KZFS-AM, KEIB-AM, WDRM-FM, WSSL-FM, WHJY-FM, WNCB-FM, KCBL-AM, WESC-FM, WTZB-FM, WDIZ-AM, WTQR-FM, KJR-AM, WCKT-FM, KLFX-FM, KTGX-FM, KHEY-AM, WFLA-AM, WJRR-FM, KMEL-FM, KTOK-AM, KZRR-FM, WIBB-FM, WQYZ-FM, KSTE-AM, WZZR-FM, KSSX-FM, WDCG-F2, WYGM-AM, KKIX-FM, KYSR-FM, KISC-F2, KSD-FM, KTBZ-FM, WJDX-FM, WTKS-AM, KOGO-AM, KMYT-FM, WLTY-FM, KRRL-FM, KIIZ-FM, WHJJ-AM, WKII-AM, WPTI-FM, KNRS-FM, WXTB-FM, WLVH-FM, KTEG-FM, WLKO-FM, WTKS-FM, WFLF-FM, KPWK-AM, WZTA-AM, WYNA-FM, KTLK-AM, KJAQ-FM, WRBV-FM, KYMT-F2, WQOL-FM, KBQI-F2, WGTR-FM, KRPT-FM, KKZX-FM, WBGG-FM, WRKH-FM, WRDG-FM, WGMY-F2, KQNT-AM, WFLA-FM, WRGV-FM, KQBT-FM, WBTP-FM, KPRC-AM, KDJE-FM, WKKV-FM, WFUS-FM, WSOL-FM, KFOO-FM, WQBT-FM, KZPS-FM, WMAD-FM, KDFO-FM, KOSO-FM, WEBZ-FM, WIHB-FM, WRTR-FM, WRKH-F2, KATZ-FM, WRXZ-FM, KBQI-FM, WMJJ-F2, WTXT-FM, WWMG-FM, WJBT-FM, KGB-AM, WKGR-FM, WZZR-F2, WTLY-AM, KVNS-AM, KUCD-F2, WWCD-AM, KQOD-FM, KWSX-AM, WGST-AM, WRZX-AM, WIHB-AM, WMIA-F3",3007801946,3007801946
a390ecb4-4aca-41a8-84b3-814b8b1b08f1,572,572,"WPOC-FM, WQSR-FM, WZFT-FM, WCAO-AM",97512068,97512068
c3b57860-1b76-4ef6-8e93-1071deb549b2,838,838,"WXDX-FM, WKST-FM, WWSW-FM, WDVE-FM, WPGB-FM",111663783,111663783
ea1de6da-f6e9-44b4-93d7-4b421285b6b3,166,166,"KDMX-FM, KHKS-FM",65270220,65270220
ea75854c-bdf5-4484-9897-7900c65b1e16,345,345,"WEND-FM, WRFX-FM, WLKO-FM, WHQC-FM, WNKS-FM, WKKT-FM, WSOC-FM, WPEG-FM, WBAV-FM",38599689,38599689
"258c646d-eecb-4b2f-a35d-97636d2acdcb",981,981,"KUBT-FM, KUCD-FM, KIKI-AM, KSSK-FM, KDNN-FM, KHVH-AM",75646014,75646014
"365737c8-1f5d-46c7-a296-86e9d95520b9",997,997,"KVDU-FM, WRKN-FM, WRNO-FM, WQUE-FM, WRNO-F2, KMEZ-FM, WYLD-FM, WNOE-FM, WZRH-FM, WWL-FM",81017804,81017804
"50a706ba-234f-4bcd-991d-a08c4ddbe62c",1747,1747,"KTOP-AM, KMAJ-FM, KYIS-FM, KTST-FM, KZSN-FM, KCFX-FM, KRBB-FM, KATT-FM, KJYO-FM, KFDI-FM, WWLS-FM, KTHR-FM, KZCH-FM, KWIC-FM, KMAJ-AM, KTOP-FM, KDVV-FM, KCMO-F2, KGHM-AM, KMJK-FM, KKWD-FM, KCJK-FM, KXXY-FM, KCMO-FM, KWPN-AM, KTOK-AM, KOKQ-FM",101728264,101728264
"9f554646-d9a2-4d34-8b3b-3169e6e743fc",353,353,"KODJ-FM, KZHT-FM, KAAZ-FM, KNRS-FM, KJMY-FM, KJMY-F2",40085041,40085041
a81835f6-066b-4dcc-811b-e53457553042,1003,1003,"KODA-FM, KQBT-FM, KTRH-AM, KRBE-FM, KTBZ-FM, KPRC-AM, KBME-AM, KRBE-F2",461918019,461918019
